{
    "$schema": "http://json-schema.org/draft-04/schema#",
    "type": "array",
    "items": {
        "type": "object",
        "properties": {
            "selfId": {
                "type": "integer"
            },
            "template": {
                "type": "object",
                "properties": {
                    "kind": {
                        "type": "string"
                    },
                    "name": {
                        "type": "string"
                    },
                    "class1": {
                        "type": "integer"
                    },
                    "class2": {
                        "type": "integer"
                    },
                    "mass": {
                        "type": "integer"
                    },
                    "price": {
                        "type": "integer"
                    }
                },
                "required": [
                    "kind",
                    "name",
                    "class1",
                    "class2",
                    "mass",
                    "price"
                ]
            },
            "stats": {
                "type": "object",
                "properties": {
                    "pDef": {
                        "type": "integer"
                    },
                    "maxMp": {
                        "type": "integer"
                    }
                },
                "required": [
                    "pDef",
                    "maxMp"
                ]
            },
            "etc": {
                "type": "object",
                "properties": {
                    "slot": {
                        "type": "integer"
                    }
                },
                "required": [
                    "slot"
                ]
            }
        },
        "required": [
            "selfId",
            "template",
            "stats",
            "etc"
        ]
    }
}
