[{
    "selfId": 425,
    "template": { "kind": "Armor", "name": "Apprentice's Tunic", "class1": 1, "class2": 1, "mass": 2150, "price": 26 },
    "stats": { "pDef": 17, "maxMp": 19 },
    "etc": { "slot": 10 }
},{
    "selfId": 461,
    "template": { "kind": "Armor", "name": "Apprentice's Stockings", "class1": 1, "class2": 1, "mass": 1100, "price": 6 },
    "stats": { "pDef": 10, "maxMp": 10 },
    "etc": { "slot": 11 }
},{
    "selfId": 1146,
    "template": { "kind": "Armor", "name": "Squire's Shirt", "class1": 1, "class2": 1, "mass": 3301, "price": 26 },
    "stats": { "pDef": 33, "maxMp": 0 },
    "etc": { "slot": 10 }
},{
    "selfId": 1147,
    "template": { "kind": "Armor", "name": "Squire's Pants", "class1": 1, "class2": 1, "mass": 1750, "price": 6 },
    "stats": { "pDef": 20, "maxMp": 0 },
    "etc": { "slot": 11 }
}]
